{
  "schema_version": "benchmark.tutor-proposal.v1",
  "candidate_id": "golden-successive-sums",
  "candidate_version": "v1",
  "proposed_next_node": "sum_i_plus_1_probe",
  "traversed_bridge_ids": ["successive_sums"],
  "shown_representation": ["numbers_row", "current_box", "next_box"],
  "disclosed_concepts": ["sum_i", "i_changes_box"],
  "answer_revealed": false,
  "rendered_text": "Keep the current box visible and show the next box on the same numbers row. Ask for the next box sum without revealing it."
}
