{
  "schema_version": "benchmark.tutor-proposal.v1",
  "candidate_id": "public-fixture",
  "candidate_version": "final-loop-good-exposure-v1",
  "proposed_next_node": "expose_final_combined_loop",
  "traversed_bridge_ids": ["assemble_grounded_pieces"],
  "shown_representation": ["full_combined_code", "control_structure_summary"],
  "disclosed_concepts": ["final_combined_loop", "assembled_solution"],
  "answer_revealed": true,
  "rendered_text": "Assemble the grounded pieces into the full loop: outer enumerate, stop check, first-box S.append(0) plus range(k) update, max initialization, later-box recurrence, and max update."
}