{
  "schema_version": "benchmark.tutor-proposal.v1",
  "candidate_id": "deterministic.reference",
  "candidate_version": "v0.1",
  "proposed_next_node": "write_Si",
  "traversed_bridge_ids": ["S0_to_Si_when_i0"],
  "shown_representation": ["array", "index_row", "box", "i_equals_0"],
  "disclosed_concepts": ["S0_equals_Si_when_i0"],
  "answer_revealed": false,
  "rendered_text": "Here i is still 0, so S[0] and S[i] point to the same stored item. Keep the same chart and write the same max_sum line using S[i]."
}
