{
  "schema_version": "benchmark.tutor-proposal.v1",
  "candidate_id": "reference.enumerate",
  "candidate_version": "v0.1",
  "proposed_next_node": "probe_pair_for_7_changed_chart",
  "traversed_bridge_ids": [],
  "shown_representation": ["numbers_row", "index_row", "number_row", "enumerate_relation"],
  "disclosed_concepts": ["enumerate_relation"],
  "answer_revealed": false,
  "rendered_text": "In this changed array, when the loop reaches a = 7, what pair does enumerate(a) give us?"
}
