{
  "schema_version": "benchmark.tutor-proposal.v1",
  "candidate_id": "fixture.good.first-comparison",
  "candidate_version": "v1",
  "proposed_next_node": "probe_first_comparison",
  "traversed_bridge_ids": [],
  "shown_representation": ["index_row", "numbers_row", "window_box", "i_marker", "sum_annotation", "max_sum_annotation"],
  "disclosed_concepts": ["comparison"],
  "answer_revealed": false,
  "rendered_text": "The box is now at i = 1, S[i] = 14, and max_sum = 12. Is S[i] bigger than max_sum?"
}
